{
  "dataset_version": "cl-synth-ml_dev-20261006-8ad556a",
  "config_name": "ml_dev",
  "global_seed": 20261006,
  "generator_git_sha": "8ad556a7ac5948bad71a1062bd7fa8b5c017f5c3",
  "row_counts": {
    "customers": 25000,
    "transactions": 509244,
    "campaign": 1,
    "exposures": 12491,
    "outcomes": 12491,
    "features": 12491,
    "splits": 25000,
    "hidden_uplift": 25000
  },
  "treatment_rate": 0.4953,
  "file_checksums": {
    "customers.json": "978d7c3327bfeb8733a44937a561ce9f873380bde258d2d27ccc8704d70120bf",
    "transactions.json": "51a5d81305ca0ec4beabdaf9e5f967a339224ce8f38d9fa35860c6074f6e3aed",
    "campaign.json": "edea734944af427da06d17d4aa194a23779ba561ab94285fb61f3458f7b0274b",
    "exposures.json": "4792d41b9185d17a49b2abe24630b33439122a03b6233756b8a9642f0fc16908",
    "outcomes.json": "b2fd56407289edb1c87af4645b07ec6bb20f0ce79cc6ede953cc67b761959758",
    "features.json": "543243d6392a3e0b174c81184c1a2c2005b61d5efc3adaba887afcfac20a7e35",
    "splits.json": "07b793be1563392c65d945d98d6551831afbc79a8c438b22260c83c830bf221f",
    "hidden_uplift.json": "a5aa00db4882980a929f91ecc43c51204ac632f6e882f52d929a7c4a011603c5"
  },
  "validation_status": "passed",
  "created_at": "2026-10-02T23:18:41.907164+00:00"
}
